,General Information,Algar,Claro,Oi,Sercomtel,Sky,Tim,VivoM1,Corporate name,Algar Telecom,Claro S.A.,Telemar Norte Leste S.A.,SERCOMTEL S.A. - TELECOMUNICAÇÕES,SKY SERVIÇOS DE BANDA LARGA LTDA,"TIM CELULAR S/A.,","TELEFÔNICA BRASIL S.A., "M2,Link for terms of use,"https://www.algartelecom.com.br/para-voce/atendimento/contratoshttps://www.algartelecom.com.br/politicadePrivacidade.htmlhttps://algartelecom.com.br/para-voce/atendimento/regulamentos","http://www.netcombo.com.br/minha-net/contratos-e-regulamentoshttp://www.netcombo.com.br/documentos/CONTRATO-NET-VIRTUA---Claro-S.A.---S%C3%83O-PAULO-1374091908318.pdfhttp://www.netcombo.com.br/documentos/PLANO-DE-SERVI%C3%87O-BL_10M_Final-1374091844454.pdfhttp://www.netcombo.com.br/documentos/PLANO-DE-SERVI%C3%87O-BL_2M-IP_Final-1374091844469.pdfhttp://www.netcombo.com.br/politica-de-privacidade","http://www.oi.com.br/ArquivosEstaticos/oi/docs/pdf/oivelox_regs/Regulamento_Banda_Larga_R1.pdfhttp://www.oi.com.br/ArquivosEstaticos/oi/docs/pdf/oivelox_regs/contrato-de-adesao-banda-larga-da-oi-residencial-r1-b2c.pdfhttp://www.oi.com.br/oi/sobre-a-oi/empresa/informacoes/politica-de-uso-aceitavelhttp://www.oi.com.br/oi/sobre-a-oi/empresa/informacoes/politica-de-seguranca-informacao","http://prodweb.sercomtel.com.br/sistemas/portalBandaLarga/res/documentos/contrato_supervia.pdf ou http://www.sercomtel.com.br/portalSercomtel/bandalarga.planoIdeal.dohttp://prodweb.sercomtel.com.br/sistemas/portalBandaLarga/res/documentos/anexo_ideal.pdfhttp://prodweb.sercomtel.com.br/sistemas/portalBandaLarga/res/documentos/regulamento_banda_larga_ideal_concessionaria.pdfhttps://aplweb.sercomtel.com.br/areaCliente/politicaPrivacidade.do","http://www.skybandalarga.com.br/Content/pdf/condicoes.pdfhttps://www.sky.com.br/contratoshttps://digitalapi.sky.com.br/media/site/SUM%C3%81RIO%20BL%2020092016.pdfhttps://www.sky.com.br/politica-de-privacidade","http://www.tim.com.br/Portal_Conteudo/_staticfiles/dpmFiles/pdf/Contrato%20de%20Presta%C3%A7%C3%A3o%20de%20Servi%C3%A7os%20Live%20TIM.pdfhttp://www.tim.com.br/Portal_Conteudo/_staticfiles/dpmFiles/pdf/Regulamento%20Live%20TIM.pdf","http://www.vivo.com.br/consumo/groups/public/documents/documentopw/contrib_102096.pdf?_ga=1.116517382.1401368986.1487004065https://www.vivo.com.br/consumo/groups/public/documents/documentopw/contrib_102074.pdfhttps://www.vivo.com.br/consumo/groups/public/documents/documentopw/contrib_102095.pdfhttp://www.vivo.com.br/portalweb/appmanager/env/web?_nfpb=true&_nfls=false&_pageLabel=vivoVivoInstPrivacidadePage#"M3,Link's lable,"Banda Larga para velocidades igual ou inferior a 10MBPlanos de Banda Larga para as velocidades superiores a 10MBPolítica de PrivacidadeRegulamento Baixa Competição Ligado 8","Contrato Net VirtuaPOLÍTICA DE PRIVACIDADEBANDA LARGA10 MegaBANDA LARGA2 Mega IP (Internet Popular)","Política de segurança da informaçãoPolítica de uso aceitávelSUMÁRIO DE CONTRATAÇÃO E REGULAMENTO DA PROMOÇÃO BANDA LARGA DA OICONTRATO DE ADESÃO À BANDA LARGA DA OI CATEGORIA RESIDENCIAL","Leia o Contrato de AdesãoLeia o Anexo Contratual da Banda Larga IdealLeia o Regulamento Banda Larga IdealPolítica de privacidade","CONDIÇÕES GERAIS DA PRESTAÇÃO DO SERVIÇO DE COMUNICAÇÃOMULTIMIDIA - BANDA LARGATERMOS E CONDIÇÕES - POLÍTICA DE PRIVACIDADESUMÁRIO DE CONTRATAÇÃODOS PLANOS - BANDA LARGA","Contrato de Prestação de Serviços TIM Live: Clique aqui e confira.Regulamento TIM Live: Clique aqui e confira.","Contrato de AdesãoPrivacidadeTermo Promocional Vivo Internet 10 MbpsInformações Gerais de Preços e Valores Promocionais"M4,Date of access,01.06.2017 e 04.06.2017,01.06.2017 e 05.06.2017,"31.05.2017, 01.06.2017, 06.06.2017",01.06.2017 e 06.06.2017,01.06.2017,01.06.2017 e 08.06.2017,01.06.2017 e 09.06.2017M5,Date of the terms of use,"Vigencia Regulamento 21/02/2017 a 31/08/2017",,"SUMÁRIO DE CONTRATAÇÃO E REGULAMENTO DA PROMOÇÃO BANDA LARGA DA OIADESÃO DE 04/05/2017 a 27/06/2017",,"Condições Gerais - 08 de maio de 2015 (registro em cartório)Sumario de Contratação - 20/09/2016","Contrato DE PRESTAÇÃO DE SERVIÇOS - 16/06/2016 (registro em cartório)Regulamento TIM Live - Vigência datas diferentes17/06/2015 a 31/03/201717/06/2016 a 16/06/2017","Contrato01 de abril de 2016. (registro cartório)Pol PrivNARegulamentos02 de Abril de 2016.Data de adesão:De 02/04/2016 até 30/06/2016Vigência:Até 31/12/2016"M6,Total number of pages (per document),"Contrato de Prestação do Serviço - Banda Larga- 7 pp.Politica de Uso Aceitável (PUA) - 5 ppRegulamento Baixa Competição - 10 pp","Contrato de Prestação de Serviço: 21 ppPolítica de privacidade NET: 2ppPLANO DE SERVIÇO DO SERVIÇO DE COMUNICAÇÃOMULTIMÍDIA DENOMINADO NET VÍRTUA 10Mbps: 6 ppPLANO DE SERVIÇO DO SERVIÇO DE COMUNICAÇÃOMULTIMÍDIA DENOMINADO NET VÍRTUA 2Mbps Internet Popular: 5 pp","CONTRATO DE ADESÃO À BANDA LARGA DA OICATEGORIA RESIDENCIAL - 15 ppPolitica de Uso Aceitável - 2ppSUMÁRIO DE CONTRATAÇÃO E REGULAMENTO DA PROMOÇÃO BANDA LARGA DA OI - 18 ppPolítica de segurança da informação - 3 pp","CONTRATO DE ADESÃO AO SERVIÇO BANDA LARGA DE ACESSO À INTERNET - 5 ppANEXO IACESSO RÁPIDO A PROVEDORES DE INTERNET - PLANO BANDA LARGA IDEAL - 2 ppPolítica de Privacidade - 1 pPROMOÇÃO BANDA LARGA IDEAL REGULAMENTO - 2 pp","CONDIÇÕES GERAIS DA PRESTAÇÃO DO SERVIÇO DE COMUNICAÇÃOMULTIMIDIA - BANDA LARGA - 13TERMOS E CONDIÇÕES - POLÍTICA DE PRIVACIDADE - 3 ppSUMÁRIO DE CONTRATAÇÃO DOS PLANOS DE BANDA LARGA DA SKY - 3 pp","CONTRATO DE PRESTAÇÃO DE SERVIÇOS - 7 ppTim Live Regulamento Oferta TIM live – 17/06/2016 a 16/06/2017 - 7 pp","CONTRATO DE ADESÃO DE PRESTAÇÃO DO SERVIÇO TELEFÔNICO FIXO COMUTADO (STFC), DO SERVIÇO DE COMUNICAÇÃO MULTIMÍDIA (SCM) E DO SERVIÇO DE ACESSO CONDICIONADO (TV POR ASSINATURA - SeAC). 33 pp (total) 23 (lidas - Cap I, II, IV)INFORMAÇÕES GERAIS DE PREÇOS INTEGRAIS e VALORES PROMOCIONAIS - 4 ppPrivacidade - 2 ppTermo Promocional - 2pp"M7,Total number of documents,3,4,4,4,3,2,4,Legality and Presentation,,,,,,,L1,Clicks necessary to open the terms of use,4,4,4,4,4,4,4L2,Level of unintelligible excerpts,21,16,19,23,22,12,16L3,Presence of terms definitions,15,19,24,10,2,8,Lista - 40 + 12L5,"Citations to legislations, norms",2,3,5,1,2,7,8L6,Citations to regulators,3,1,1,1,2,2,3L7,"Format diversity (e.g. .doc/pdf, .ppt, video, html, para download, acessível no site, etc)",2,2,2,2,2,1,2,Participation/ Awareness in Personal Data Protection,,,,,,,P1,Information whether or not users' personal data will be collected,3,1,2,1,1,1,1P2,Information on which data will be collected from user,3,2,3,2,1,1,1P3,Information on whom the company shares users' personal data with,3,1,3,2,1,3,1P4,Information on how long the company keeps users' personal data,3,3,1,3,1,3,1P5,Consent requirement for personal data collection and use,3,2,3,1,2,3,1P6,Kind of consent (only if P5 = 1),,,,,,,P6A,Requirement of acceptance of the contract/agreement,1,1,1,2,1,1,1P7,Commitment to notifying changes in the terms of use,2,2,2,2,1,1,1P8,Commitment to obtaining users’ informed consent when using their personal data for a new or incompatible purpose,3,3,3,1,3,3,1P9,Information on personal data necessary for provision of telecommunications access,3,3,1,2,1,1,1P10,Commitment to deleting identifiable personal data as soon as it is not longer necessary to provide access to the user,3,3,1,3,3,3,1P11,Commitment to ensuring that personal data is protected by state-of-the-art organisational and technical security measures,1,1,1,1,1,1,1P12,Commitment to notifying users immediately if mandatory data retention orders is received,3,3,3,3,1,1,2P13,"Commitment to notifying individuals immediately if requests for access to subscriber data, or communications data or content are received",3,3,2,3,1,1,2P14,Commitment to challenging data retention orders on behalf of the user until the domestic avenues been exhausted,3,3,2,3,1,2,2P15,"Commitment to publishing, on a regular basis, information about personal and communications data and content that is disclosed to government authorities or other third parties",3,3,3,3,3,3,3P16,Information on grievance or remediation mechanism for users to contest disclosures of personal data in violation of the terms of service,3,3,3,3,3,3,3P17,"Commitment to providing affected users with full and comprehensive information about the personal data generated, retained and disclosed about them",3,3,3,3,3,3,2P18,Commitment to providing guarantees that personal data has been deleted and that any third parties to whom personal data has been disclosed have been requested to delete the data,3,3,3,3,3,3,1P19,"Commitment to compensating users who suffered demonstrable financial loss or substantial harm as a result of the generation, retention and disclosure of personal data",3,3,1,3,1,1,3,Empowerment,Y/N,Y/N,Y/N,Y/N,Y/N,Y/N,Y/NE1,Possibility for users to change any terms or conditions that they don't agree with,2,3,2,3,1,1,1E2,Information on what grievance and remediation mechanisms are available to enable complaints and requests for changes in the terms of service,3,3,1,3,1,1,1E3,Possibility for users to access the personal data providers hold on them,3,3,1,3,1,3,3E4,Possibility for users to request amendment of personal data,3,3,3,3,3,3,3E5,Possibility for users to delete personal data already collected,3,3,3,3,3,3,3E6,Possibility for users to withdraw consent at any time for the processing of their personal data,3,3,3,3,3,3,1E7,Commitment to not collecting applications logs,3,3,3,3,3,3,3E8,Commitment to applying standards of security,1,1,1,1,1,1,1E9,Commitment to applying standards of encryption,3,1,3,1,3,3,3E10,Commitment to allowing users to encrypt their content,3,3,3,3,3,3,3E11,Information on right to anonymity,3,2,3,1,3,3,1,Non discrimination and equity,,,,,,,D1,Considerations on protection of net neutrality,1,3,3,1,1,1,2D2,"Commitment to non discrimination against, or prioritization of content on the basis of origin, destination or service provider",3,3,1,2,2,1,2D3,"Commitment to non-restriction of content, applications or services a user can access",3,1,2,2,2,2,2D4,Commitment to only prioritising or de-prioritising content for the purpose of network management when strictly required,3,3,3,2,1,3,3D5,"Statement on not conditioning the provision of free services on restricted access to content, applications or services",3,3,3,3,3,3,3D6,"Commitment to only restricting access to content, applications or services where an order is issued by an independent judicial authority",3,3,3,3,1,2,3D7,Commitment to notifying users immediately if an order to restrict services is received,3,3,1,3,1,1,3D8,Commitment to challenging restriction of services orders through domestic avenues existent,3,3,2,2,1,2,3D9,"Commitment to publishing, on a regular basis, details of any orders received to restrict access to certain content, applications or services",3,3,3,3,3,3,3D10,"Commitment to publishing, on a regular basis, information about network management practices",3,3,3,3,1,3,3D11,"Commitment to apologising to users/ providing comprehensive information about the measures taken by the telco to prioritise, discriminate against or restrict particular content",3,3,3,3,3,3,3D12,Commitment to supporting individuals to bring legal action to seek remediation or compensation from the responsible State,3,3,3,3,1,3,3D13,Detail under which circumstances related to network management the company may restrict services to users,2,2,2,2,2,2,2,Specific Topics related to Human Rights (Censorship and Surveillance),,,,,,,H1,Information on possible reasons for Internet shutdowns/ disconnection of services,1,1,1,1,1,1,1H2,Commitment to challenging shutdown orders through domestic avenues existent,3,3,3,3,1,2,2H3,Commitment to notifying users immediately of a forthcoming shutdown,3,3,1,1,1,1,1H4,Commitment to providing up-to-date information to users about the shutdown,3,3,3,3,3,3,3H5,Information on grievance and remediation mechanisms to remedy any negative impacts of the shutdown ,3,3,3,3,1,3,3H6,Commitment to immediately restoring network connectivity after a shutdown at the earliest available opportunity,3,3,3,3,2,3,3H7,"Commitment to inviting and recording the accounts of users, enabling those whose connectivity was restricted to explain and document their experiences of the shutdown",3,3,3,3,3,3,3H8,Commitment to extending account credits or promotions as a form of universal compensation for shutdowns or altering bill payment periods,3,3,1,1,1,1,1H9,Commitment to compensating users who suffered demonstrable financial loss or substantial harm as a result of the shutdown,3,2,1,2,1,1,3H10,Commitment that the provider will never disconnect an individual’s access as a voluntary or punitive measure,2,2,2,2,2,2,2H11,Commitment that to disconnect a users’ internet access a disconnection order by an independent judicial authority is necessary,3,2,2,2,3,2,2H12,Commitment to challenging disconnection orders through domestic avenues existent,3,3,3,3,1,2,3H13,Commitment to notifying users immediately of a forthcoming disconnection,3,1,2,1,1,1,1H14,Commitment to immediately restoring network connectivity after a disconnection to the affected users at the earliest available opportunity,3,3,1,1,2,1,1H15,Commitment to compensating users who suffered demonstrable financial loss or substantial harm as a result of the disconnection,3,3,1,3,1,2,3H16,Commitment to scrutinising any request or demand from States to retrofit or modify existing telecommunications infrastructure,3,3,1,3,1,1,1H17,Commitment to scrutinising any request or demand from States to install surveillance capabilities,3,3,3,1,3,1,1H18,Commitment to exhausting all available remedies to challenge any request or demand to retrofit or modify infrastructure,3,3,3,3,1,3,3H19,Commitment to exhausting all available remedies to challenge any request or demand to install surveillance capabilities,3,3,3,3,1,3,3H20,"Commitment to publishing information, to the greatest extent possible, about any measures taken to retrofit or modify infrastructure ",3,3,3,3,3,3,3H21,"Commitment to publishing information, to the greatest extent possible, about any measures taken to install surveillance or provide direct access to other parties",3,3,3,3,3,3,3H22,"Commitment to wherever feasible, notifying users of specific surveillance measures to which they have been subject",3,3,3,3,3,1,3H23,Commitment to providing a grievance or remediation mechanism to enable users to challenge the telco’s decision to comply with requests or demands,3,3,3,3,3,3,3H24,"Commitment to apologizing and notifying affected users, providing full and comprehensive information about the type and scope of surveillance to which they were subjected",3,3,3,3,3,3,3H25,"Commitment to inviting and recording the accounts of affected users, enabling them to explain and document their experiences of the surveillance",3,3,3,3,3,3,3H26,Commitment to compensating users who suffered demonstrable financial loss or substantial harm as a result of the surveillance,3,3,3,3,1,1,3H27,Commitment to supporting individuals to bring legal action to seek remediation or compensation from the responsible State for surveillance,3,3,3,3,3,3,3,Quality of service,,,,,,,Q1,Information on guaranteed percentage of the hired connection speed,1,1,1,2,1,1,1Q2,Possibility for users to check hired vs. actual speed ,4,4,4,1,4,4,1Q3,Datacap is not adopted as a commercial practice,1,2,2,2,2,1,2Q4,Possibility of connection degradation after reaching datacap limit (only if Q3 = 2),"(1) Yes(2) No(3) Absent information",1,1,1,1,"(1) Yes(2) No(3) Absent information",2Q5,Possibility of connection suspension after reaching datacap limit (only if Q3 = 2),"(1) Yes(2) No(3) Absent information",2,2,2,2,"(1) Yes(2) No(3) Absent information",1Q6,Information on whether or not the company comply with a consumer's board ,3,3,3,3,3,3,3,Connection sharing,,,,,,,S1,Commitment to allowing connection sharing for any purposes (commercial or not),2,1,2,2,2,2,2S2,Commitment to allowing connection sharing for non-profit purposes,2,1,2,2,2,2,2